{
  "$schema": "http://json-schema.org/draft-07/schema#",
  "$id": "https://github.com/UniverseCitiz3n/IntuneRosetta-mcp/db/contribution-schema.json",
  "title": "IntuneRosetta Policy Contribution",
  "description": "Schema for a contribution file — a JSON array of policy records to add to the IntuneRosetta knowledge base.",
  "type": "array",
  "items": {
    "type": "object",
    "required": ["normalized_key", "name", "csp_path", "category"],
    "additionalProperties": false,
    "properties": {
      "normalized_key": {
        "type": "string",
        "description": "Unique underscore-delimited identifier for this policy record (lowercase, no device_vendor_msft_ prefix). Pattern: ^[a-z0-9_]+$",
        "pattern": "^[a-z0-9_]+$"
      },
      "name": {
        "type": "string",
        "description": "Human-readable policy name (minimum 3 characters).",
        "minLength": 3
      },
      "csp_path": {
        "type": "string",
        "description": "Canonical OMA-URI CSP path starting with ./Device/Vendor/MSFT/ or ./User/Vendor/MSFT/",
        "pattern": "^\\./(?:Device|User)/Vendor/MSFT/"
      },
      "category": {
        "type": "string",
        "description": "Policy category (e.g. 'Defender ASR', 'BitLocker', 'LAPS', 'Windows Hello').",
        "minLength": 1
      },
      "description": {
        "type": "string",
        "description": "Human-readable explanation of what this policy controls."
      },
      "docs_url": {
        "type": "string",
        "description": "URL to the official Microsoft documentation for this policy.",
        "format": "uri"
      },
      "value_map": {
        "type": "object",
        "description": "Map of raw integer/string values to human-readable labels (e.g. {\"0\": \"Disabled\", \"1\": \"Block\", \"2\": \"Audit\"}).",
        "additionalProperties": {
          "type": "string"
        }
      },
      "is_deprecated": {
        "type": "boolean",
        "description": "Set to true when this policy has been superseded. Defaults to false.",
        "default": false
      },
      "replaced_by_csp": {
        "type": "string",
        "description": "normalized_key of the replacement record (required when is_deprecated is true).",
        "pattern": "^[a-z0-9_]+$"
      },
      "deprecation_notice": {
        "type": "string",
        "description": "Free-text explanation of why this policy is deprecated (date, context, migration guidance)."
      }
    },
    "allOf": [
      {
        "if": {
          "properties": {
            "is_deprecated": { "const": true }
          },
          "required": ["is_deprecated"]
        },
        "then": {
          "required": ["replaced_by_csp"]
        }
      }
    ]
  }
}
