[
  {
    "normalized_key": "policy_config_defender_allowcloudprotection",
    "name": "Defender: Allow cloud-delivered protection",
    "description": "Enables cloud-delivered protection (MAPS) in Microsoft Defender Antivirus. Cloud protection provides fast, real-time analysis of new and emerging threats.",
    "csp_path": "./Device/Vendor/MSFT/Policy/Config/Defender/AllowCloudProtection",
    "category": "Defender",
    "docs_url": "https://learn.microsoft.com/en-us/windows/client-management/mdm/policy-csp-defender#allowcloudprotection",
    "value_map": {
      "0": "Disabled",
      "1": "Enabled"
    },
    "is_deprecated": false
  },
  {
    "normalized_key": "policy_config_defender_submitsamplesconsent_legacy",
    "name": "Defender: Submit Samples Consent (Legacy)",
    "description": "Legacy setting for automatic sample submission. Superseded by the modern SubmitSamplesConsent setting which includes additional granularity.",
    "csp_path": "./Device/Vendor/MSFT/Policy/Config/Defender/SubmitSamplesConsent",
    "category": "Defender",
    "docs_url": "https://learn.microsoft.com/en-us/windows/client-management/mdm/policy-csp-defender",
    "value_map": {
      "0": "Always prompt",
      "1": "Send safe samples automatically",
      "2": "Never send",
      "3": "Send all samples automatically"
    },
    "is_deprecated": true,
    "replaced_by_csp": "policy_config_defender_submitsamplesconsent",
    "deprecation_notice": "Use the 'policy_config_defender_submitsamplesconsent' record which includes the full value map and updated documentation. Deprecated since Intune Settings Catalogue update 2023-Q4."
  }
]
